id;sith;jedi;other;brief_history;force_user_id
1;true;false;false;Depois de se voltar para o lado sombrio da Força, ele ficou conhecido como Darth Vader—Lorde Sombrio dos Sith e aprendiz do Imperador Darth Sidious;1
2;true;false;false;Maul nasceu de Mãe Talzin e criado como um Irmão da Noite em Dathomir, antes de ser tomado por Darth Sidious como seu aprendiz.;2
3;false;false;true;Tano foi descoberta em seu planeta natal Shili pelo Mestre Jedi Plo Koon, que a trouxe ao Templo Jedi em Coruscant para receber o treinamento Jedi que mais tarde abandonou.;3
4;true;false;false;O imperador;4
5;false;true;false;Obi-Wan Kenobi, mais tarde conhecido também como Ben Kenobi durante seu exílio, foi um Humano Mestre Jedi que serviu à República Galáctica;5